Clave;Nombre;Asterisco
S653;Traumatismo del arco palmar profundo;F
S654;Traumatismo de vaso(s) sanguíneo(s) del pulgar;F
S655;Traumatismo de vaso(s) sanguíneo(s) de otro dedo;F
S657;Traumatismo de múltiples vasos sanguíneos a nivel de la muñeca y de la mano;F
S658;Traumatismo de otros vasos sanguíneos a nivel de la muñeca y de la mano;F
S659;Traumatismo de vaso sanguíneo no especificado, a nivel de la muñeca y de la mano;F
S660;Traumatismo del tendón y músculo flexor largo del pulgar a nivel de la muñeca y de la mano;F
S661;Traumatismo del tendón y músculo flexor de otro dedo a nivel de la muñeca y de la mano;F
S662;Traumatismo del tendón y músculo extensor del pulgar a nivel de la muñeca y de la mano;F
S663;Traumatismo del tendón y músculo extensor de otro(s) dedo(s) a nivel de la muñeca y de la mano;F
S664;Traumatismo del músculo y tendón intrínseco del pulgar a nivel de la muñeca y de la mano;F
S665;Traumatismo del músculo y tendón intrínseco de otro(s) dedo(s) a nivel de la muñeca y de la mano;F
S666;Traumatismo de múltiples tendones y músculos flexores a nivel de la muñeca y de la mano;F
S667;Traumatismo de múltiples tendones y músculos extensores a nivel de la muñeca y de la mano;F
S668;Traumatismo de otros tendones y músculos a nivel de la muñeca y de la mano;F
S669;Traumatismo de tendón y músculo no especificado, a nivel de la muñeca y de la mano;F
S670;Traumatismo por aplastamiento del pulgar y otro(s) dedo(s);F
S678;Traumatismo por aplastamiento de otras partes y de las no especificadas de la muñeca y de la mano;F
S680;Amputación traumática del pulgar (completa) (parcial);F
S681;Amputación traumática de otro dedo único (completa) (parcial);F
S682;Amputación traumática de dos o más dedos solamente (completa) (parcial);F
S683;Amputación traumática combinada (de parte) de dedo(s) con otras partes de la muñeca y de la mano;F
S684;Amputación traumática de la mano a nivel de la muñeca;F
S688;Amputación traumática de otras partes de la muñeca y de la mano;F
S689;Amputación traumática de la muñeca y de la mano, nivel no especificado;F
S697;Otros traumatismos múltiples de la muñeca y de la mano;F
S698;Otros traumatismos especificados de la muñeca y de la mano;F
S699;Traumatismo no especificado de la muñeca y de la mano;F
S700;Contusión de la cadera;F
S701;Contusión del muslo;F
S707;Traumatismos superficiales múltiples de la cadera y del muslo;F
S708;Otros traumatismos superficiales de la cadera y del muslo;F
S709;Traumatismo superficial de la cadera y del muslo, no especificado;F
S710;Herida de la cadera;F
S711;Herida del muslo;F
S717;Heridas múltiples de la cadera y del muslo;F
S718;Herida de otras partes y de las no especificadas de la cintura pélvica;F
S720;Fractura del cuello de fémur;F
S721;Fractura pertrocanteriana;F
S722;Fractura subtrocanteriana;F
S723;Fractura de la diáfisis del fémur;F
S724;Fractura de la epífisis inferior del fémur;F
S727;Fracturas múltiples del fémur;F
S728;Fracturas de otras partes del fémur;F
S729;Fractura del fémur, parte no especificada;F
S730;Luxación de la cadera;F
S731;Esguinces y torceduras de la cadera;F
S740;Traumatismo del nervio ciático a nivel de la cadera y del muslo;F
S741;Traumatismo del nervio femorocutáneo a nivel de la cadera y del muslo;F
S742;Traumatismo del nervio sensorial cutáneo a nivel de la cadera y del muslo;F
S747;Traumatismo de nervios múltiples a nivel de la cadera y del muslo;F
S748;Traumatismo de otros nervios a nivel de la cadera y del muslo;F
S749;Traumatismo de nervio no especificado a nivel de la cadera y del muslo;F
S750;Traumatismo de la arteria femoral;F
S751;Traumatismo de la vena femoral a nivel de la cadera y del muslo;F
S752;Traumatismo de la gran vena safena a nivel de la cadera y del muslo;F
S757;Traumatismo de múltiples vasos sanguíneos a nivel de la cadera y del muslo;F
S758;Traumatismo de otros vasos sanguíneos a nivel de la cadera y del muslo;F
S759;Traumatismo de vaso sanguíneo no especificado a nivel de la cadera y del muslo;F
S760;Traumatismo del tendón y músculo de la cadera;F
S761;Traumatismo del tendón y músculo cuádriceps;F
S762;Traumatismo del tendón y músculo aductor mayor del muslo;F
S763;Traumatismo de tendón y músculo del grupo muscular posterior a nivel del muslo;F
S764;Traumatismo de otros tendones y músculos y los no especificados a nivel del muslo;F
S767;Traumatismo de múltiples tendones y músculos a nivel de la cadera y del muslo;F
S770;Traumatismo por aplastamiento de la cadera;F
S771;Traumatismo por aplastamiento del muslo;F
S772;Traumatismo por aplastamiento de la cadera con el muslo;F
S780;Amputación traumática de la articulación de la cadera;F
S781;Amputación traumática en algún nivel entre la cadera y la rodilla;F
S789;Amputación traumática de cadera y muslo, nivel no especificado;F
S797;Traumatismos múltiples de la cadera y del muslo;F
S798;Otros traumatismos especificados de la cadera y del muslo;F
S799;Traumatismo no especificado de la cadera y del muslo;F
S800;Contusión de la rodilla;F
S801;Contusión de otras partes y las no especificadas de la pierna;F
S807;Traumatismos superficiales múltiples de la pierna;F
S808;Otros traumatismos superficiales de la pierna;F
S809;Traumatismo superficial de la pierna, no especificado;F
S810;Herida de la rodilla;F
S817;Heridas múltiples de la pierna;F
S818;Herida de otras partes de la pierna;F
S819;Herida de la pierna, parte no especificada;F
S820;Fractura de la rótula;F
S821;Fractura de la epífisis superior de la tibia;F
S822;Fractura de la diáfisis de la tibia;F
S823;Fractura de la epífisis inferior de la tibia;F
S824;Fractura del peroné solamente;F
S825;Fractura del maléolo interno;F
S826;Fractura del maléolo externo;F
S827;Fracturas múltiples de la pierna;F
S828;Fractura de otras partes de la pierna;F
S829;Fractura de la pierna, parte no especificada;F
S830;Luxación de la rótula;F
S831;Luxación de la rodilla;F
S832;Desgarro de meniscos, presente;F
S833;Desgarro del cartílago articular de la rodilla, presente;F
S834;Esguinces y torceduras que comprometen los ligamentos laterales (externo) (interno) de la rodilla;F
S835;Esguinces y torceduras que comprometen el ligamento cruzado (anterior) (posterior) de la rodilla;F
S836;Esguinces y torceduras de otras partes y las no especificadas de la rodilla;F
S837;Traumatismo de estructuras múltiples de la rodilla;F
S840;Traumatismo del nervio tibial a nivel de la pierna;F
S841;Traumatismo del nervio peroneo a nivel de la pierna;F
S842;Traumatismo del nervio sensorial cutáneo a nivel de la pierna;F
S847;Traumatismo de nervios múltiples a nivel de la pierna;F
S848;Traumatismo de otros nervios a nivel de la pierna;F
S849;Traumatismo de nervio no especificado a nivel de la pierna;F
S850;Traumatismo de la arteria poplítea;F
S851;Traumatismo de la arteria tibial (anterior) (posterior);F
S852;Traumatismo de la arteria peronea;F
S853;Traumatismo de la gran vena safena a nivel de la pierna;F
S854;Traumatismo de la vena safena externa a nivel de la pierna;F
S855;Traumatismo de la vena poplítea;F
S857;Traumatismo de vasos sanguíneos múltiples a nivel de la pierna;F
S858;Traumatismo de otros vasos sanguíneos a nivel de la pierna;F
S859;Traumatismo de vaso sanguíneo no especificado a nivel de la pierna;F
S860;Traumatismo del tendón de Aquiles;F
S861;Traumatismo de otro(s) tendón(es) y músculo(s) del grupo muscular posterior a nivel de la pierna;F
S862;Traumatismo de tendón(es) y músculo(s) del grupo muscular anterior a nivel de la pierna;F
S863;Traumatismo de tendón(es) y músculo(s) del grupo muscular peroneo a nivel de la pierna;F
S867;Traumatismo de múltiples tendones y músculos a nivel de la pierna;F
S868;Traumatismo de otros tendones y músculos a nivel de la pierna;F
S869;Traumatismo de tendón y músculo no especificado a nivel de la pierna;F
S870;Traumatismo por aplastamiento de la rodilla;F
S878;Traumatismo por aplastamiento de otras partes y de las no especificadas de la pierna;F
S880;Amputación traumática a nivel de la rodilla;F
S881;Amputación traumática en algún nivel entre la rodilla y el tobillo;F
S889;Amputación traumática de la pierna, nivel no especificado;F
S897;Traumatismos múltiples de la pierna;F
S898;Otros traumatismos de la pierna, especificados;F
S899;Traumatismo de la pierna, no especificado;F
S900;Contusión del tobillo;F
S901;Contusión de dedo(s) del pie sin daño de la(s) uña(s);F
S902;Contusión de dedo(s) del pie con daño de la(s) uña(s);F
S903;Contusión de otras partes y de las no especificadas del pie;F
S907;Traumatismos superficiales múltiples del pie y del tobillo;F
S908;Otros traumatismos superficiales del pie y del tobillo;F
S909;Traumatismo superficial del pie y del tobillo, no especificado;F
S910;Herida del tobillo;F
S911;Herida de dedo(s) del pie sin daño(s) de la(s) uña(s);F
S912;Herida de dedo(s) del pie con daño(s) de la(s) uña(s);F
S913;Herida de otras partes del pie;F
S917;Heridas múltiples del tobillo y del pie;F
S920;Fractura del calcáneo;F
S921;Fractura del astrágalo;F
S922;Fractura de otro(s) hueso(s) del tarso;F
S923;Fractura de hueso del metatarso;F
S924;Fractura de los huesos del dedo gordo del pie;F
S925;Fractura de los huesos de otro(s) dedo(s) del pie;F
S927;Fracturas múltiples del pie;F
S929;Fractura del pie, no especificada;F
S930;Luxación de la articulación del tobillo;F
S931;Luxación de dedo(s) del pie;F
S932;Ruptura de ligamentos a nivel del tobillo y del pie;F
S933;Luxación de otros sitios y los no especificados del pie;F
S934;Esguinces y torceduras del tobillo;F
S935;Esguinces y torceduras de dedo(s) del pie;F
S936;Esguinces y torceduras de otros sitios y los no especificados del pie;F
S940;Traumatismo del nervio plantar externo;F
S941;Traumatismo del nervio plantar interno;F
S942;Traumatismo del nervio peroneal profundo a nivel del pie y del tobillo;F
S943;Traumatismo de nervio sensorial cutáneo a nivel del pie y del tobillo;F
S947;Traumatismo de múltiples nervios a nivel del pie y del tobillo;F
S948;Traumatismo de otros nervios a nivel del pie y del tobillo;F
S949;Traumatismo de nervio no especificado a nivel del pie y del tobillo;F
S950;Traumatismo de la arteria dorsal del pie;F
S951;Traumatismo de la arteria plantar del pie;F
S952;Traumatismo de la vena dorsal del pie;F
S957;Traumatismo de múltiples vasos sanguíneos a nivel del pie y del tobillo;F
S958;Traumatismo de otros vasos sanguíneos a nivel del pie y del tobillo;F
S959;Traumatismo de vaso sanguíneo no especificado a nivel de pie y del tobillo;F
S960;Traumatismo del tendón y músculo del flexor largo del dedo a nivel del pie y del tobillo;F
S961;Traumatismo del tendón y músculo del extensor largo del (de los) dedo(s) a nivel del pie y del tobillo;F
S962;Traumatismo de tendones y músculos intrínsecos a nivel del pie y del tobillo;F
S967;Traumatismo de múltiples tendones y músculos a nivel del pie y del tobillo;F
S968;Traumatismo de otros tendones y músculos a nivel del pie y del tobillo;F
S969;Traumatismo de tendones y músculos no especificados a nivel del pie y del tobillo;F
S970;Traumatismo por aplastamiento del tobillo;F
S971;Traumatismo por aplastamiento de dedo(s) del pie;F
S978;Traumatismo por aplastamiento de otras partes del pie y del tobillo;F
S980;Amputación traumática del pie a nivel del tobillo;F
S981;Amputación traumática de un dedo del pie;F
S982;Amputación traumática de dos a más dedos del pie;F
S983;Amputación traumática de otras partes del pie;F
S984;Amputación del pie, nivel no especificado;F
S997;Otros traumatismos múltiples del pie y del tobillo;F
S998;Otros traumatismos del pie y del tobillo, especificados;F
S999;Traumatismo del pie y del tobillo, no especificado;F
T000;Traumatismos superficiales que afectan la cabeza con el cuello;F
T001;Traumatismos superficiales que afectan el tórax con el abdomen, la región lumbosacra y la pelvis;F
T002;Traumatismos superficiales que afectan múltiples regiones del(os) miembro(s) superior(es);F
T003;Traumatismos superficiales que afectan múltiples regiones del(de los) miembro(s) inferior(es);F
T006;Traumatismos superficiales que afectan múltiples regiones del (de los) miembro(s) superior(es) con miembro(s) inferior(es);F
T008;Traumatismos superficiales que afectan otras combinaciones de regiones del cuerpo;F
T009;Traumatismos superficiales múltiples, no especificados;F
T010;Heridas que afectan la cabeza con el cuello;F
T011;Heridas que afectan el tórax con el abdomen, la región lumbosacra y la pelvis;F
T012;Heridas que afectan múltiples regiones del (de los) miembro(s) superior(es);F
T013;Heridas que afectan múltiples regiones del (de los) miembro(s) inferior(es);F
T016;Heridas que afectan múltiples regiones del (de los) miembro(s) superior(es) con miembro(s) inferior(es);F
T018;Heridas que afectan otras combinaciones de las regiones del cuerpo;F
T019;Heridas múltiples, no especificadas;F
T020;Fracturas que afectan la cabeza con el cuello;F
T021;Fracturas que afectan el tórax con la región lumbosacra y la pelvis;F
T022;Fracturas que afectan múltiples regiones de un miembro superior;F
T023;Fracturas que afectan múltiples regiones de un miembro inferior;F
T024;Fracturas que afectan múltiples regiones de ambos miembros superiores;F
T025;Fracturas que afectan múltiples regiones de ambos miembros inferiores;F
T026;Fracturas que afectan múltiples regiones de miembro(s) superior(es) con miembro(s) inferior(es);F
T027;Fracturas que afectan el tórax con la región lumbosacra y la pelvis con miembro(s);F
T028;Fracturas que afectan otras combinaciones de las regiones del cuerpo;F
T029;Fracturas múltiples, no especificadas;F
T030;Luxaciones, torceduras y esguinces que afectan la cabeza con el cuello;F
T031;Luxaciones, torceduras y esguinces que afectan el tórax con la región lumbosacra y la pelvis;F
T032;Luxaciones, torceduras y esguinces que afectan múltiples regiones del (de los) miembros(s) superior(es);F
T033;Luxaciones, torceduras y esguinces que afectan múltiples regiones del (de los) miembro(s) inferior(es);F
T034;Luxaciones, torceduras esguinces que afectan  múltiples regiones del (de los) miembro(s) superior(es) con miembro(s) inferior(es);F
T038;Luxaciones, torceduras y esguinces que afectan otras combinaciones de regiones del cuerpo;F
T039;Luxaciones, torceduras y esguinces múltiples, no especificados;F
T040;Traumatismos por aplastamiento que afectan la cabeza con el cuello;F
T041;Traumatismos por aplastamiento que afectan el tórax con el abdomen, la región lumbosacra y la pelvis;F
T042;Traumatismos por aplastamiento que afectan múltiples regiones del (de los) miembro(s) superior(es);F
T043;Traumatismos por aplastamiento que afectan múltiples regiones del (de los) miembro(s) inferior(es);F
T044;Traumatismos por aplastamiento que afecta múltiples regiones del (de los) miembro(s) superior(es) con miembro(s) inferior(es);F
T047;Traumatismos por aplastamiento del tórax, del abdomen, de la región lumbosacra y de la pelvis con miembro(s);F
T048;Traumatismos por aplastamiento que afectan otras combinaciones de regiones del cuerpo;F
T049;Traumatismos por aplastamiento múltiple, no especificados;F
T050;Amputación traumática de ambas manos;F
T051;Amputación traumática de una mano y el otro brazo [cualquier nivel, excepto mano];F
T052;Amputación traumática de ambos brazos [cualquier nivel];F
T053;Amputación traumática de ambos pies;F
T054;Amputación traumática de un pie y la otra pierna [cualquier nivel, excepto pie];F
T055;Amputación traumática de ambas piernas [cualquier nivel];F
T056;Amputación traumática de miembros superior(es) e inferior(es), cualquier combinación [cualquier nivel];F
T058;Amputación traumática que afecta otras combinaciones de regiones del cuerpo;F
T059;Amputaciones traumáticas múltiples, no especificadas;F
T060;Traumatismos del encéfalo y de nervios craneales con traumatismo de nervios y médula espinal a nivel del cuello;F
T061;Traumatismos de nervios y médula espinal que afectan otras múltiples regiones del cuerpo;F
T062;Traumatismos de nervios que afectan múltiples regiones del cuerpo;F
T063;Traumatismos de vasos sanguíneos que afectan múltiples regiones del cuerpo;F
T064;Traumatismos de tendones y músculos que afectan múltiples regiones del cuerpo;F
T065;Traumatismos de órganos intratorácicos con órganos intraabdominales y pélvicos;F
T068;Otros traumatismos especificados que afectan múltiples regiones del cuerpo;F
T07X;Traumatismos múltiples, no especificados;F
T08X;Fractura de la columna vertebral, nivel no especificado;F
T090;Traumatismo superficial del tronco, nivel no especificado;F
T091;Herida del tronco, nivel no especificado;F
T092;Luxación, esguince o torcedura de articulación y ligamentos del tronco, no especificado;F
T093;Traumatismo de la médula espinal, nivel no especificado;F
T094;Traumatismo de nervios, raíz de nervio espinal y plexos del tronco no especificados;F
T095;Traumatismo de tendones y músculos del tronco no especificados;F
T096;Amputación traumática del tronco, nivel no especificado;F
T098;Otros traumatismos especificados del tronco, nivel no especificado;F
T099;Traumatismo no especificado del tronco, nivel no especificado;F
T10X;Fractura de miembro superior, nivel no especificado;F
T110;Traumatismo superficial de miembro superior, nivel no especificado;F
T111;Herida de miembro superior, nivel no especificado;F
T112;Luxación, esguince o torcedura de articulación o ligamento no especificado de miembro superior, nivel no especificado;F
T113;Traumatismo de nervio no especificado de miembro superior, nivel no especificado;F
T114;Traumatismo de vasos sanguíneos no especificados de miembro superior, nivel no especificado;F
T115;Traumatismo de tendón y músculo no especificados de miembro superior, nivel no especificado;F
T116;Amputación traumática de miembro superior, nivel no especificado;F
T118;Otros traumatismos especificados de miembro superior, nivel no especificado;F
T119;Traumatismo no especificado de miembro superior, nivel no especificado;F
T12X;Fractura de miembro inferior, nivel no especificado;F
T130;Traumatismo superficial de miembro inferior, nivel no especificado.;F
T131;Herida de miembro inferior, nivel no especificado;F
T132;Luxación, esguince o torcedura de articulación y ligamentos no especificados de miembro inferior, nivel no especificado;F
T133;Traumatismo de nervios no especificados de miembro inferior, nivel no especificado;F
T134;Traumatismo de vasos sanguíneos no especificados de miembro inferior, nivel no especificado;F
T135;Traumatismo de tendones y músculos no especificados de miembro inferior, nivel no especificado;F
T136;Amputación traumática de miembro inferior, nivel no especificado;F
T138;Otros traumatismos especificados de miembro inferior, nivel no especificado;F
T139;Traumatismo no especificado de miembro inferior, nivel no especificado;F
T140;Traumatismo superficial de región no especificada del cuerpo;F
T141;Herida de región no especificada del cuerpo;F
T142;Fractura de región no especificada del cuerpo;F
T143;Luxación, esguince y torcedura de región no especificada del cuerpo;F
T144;Traumatismo de nervio(s) de región no especificada del cuerpo;F
T145;Traumatismo de vaso(s) sanguíneo(s) de región no especificada del cuerpo;F
T146;Traumatismo de tendones y músculos de región no especificada del cuerpo;F
T147;Traumatismo por aplastamiento y amputación traumática de regiones no especificadas del cuerpo;F
T148;Otros traumatismos de región no especificada del cuerpo;F
T149;Traumatismo, no especificado;F
T150;Cuerpo extraño en la córnea;F
T151;Cuerpo extraño en el saco conjuntival;F
T158;Cuerpo extraño en otras y en múltiples partes de la parte externa del ojo;F
T159;Cuerpo extraño en parte externa del ojo, sitio no especificado;F
T16X;Cuerpo extraño del oído;F
T170;Cuerpo extraño en seno paranasal;F
T171;Cuerpo extraño en el orificio nasal;F
T172;Cuerpo extraño en la faringe;F
T173;Cuerpo extraño en la laringe;F
T174;Cuerpo extraño en la tráquea;F
T175;Cuerpo extraño en bronquios;F
T178;Cuerpo extraño en otras y en múltiples partes de las vías respiratorias;F
T179;Cuerpo extraño en las vías respiratorias, parte no especificada;F
T180;Cuerpo extraño en la boca;F
T181;Cuerpo extraño en el esófago;F
T182;Cuerpo extraño en el estómago;F
T183;Cuerpo extraño en el intestino delgado;F
T184;Cuerpo extraño en el colon;F
T185;Cuerpo extraño en el ano y en el recto;F
T188;Cuerpo extraño en otras y en múltiples partes del tubo digestivo;F
T189;Cuerpo extraño en el tubo digestivo, parte no especificada;F
T190;Cuerpo extraño en la uretra;F
T191;Cuerpo extraño en la vejiga;F
T192;Cuerpo extraño en la vulva y en la vagina;F
T193;Cuerpo extraño en el útero [cualquier parte];F
T198;Cuerpo extraño en otras y en múltiples partes de las vías genitourinarias;F
T199;Cuerpo extraño en las vías genitourinarias, parte no especificada;F
T200;Quemadura de la cabeza y del cuello, grado no especificado;F
T201;Quemadura de la cabeza y del cuello, de primer grado;F
T202;Quemadura de la cabeza y del cuello, de segundo grado;F
T203;Quemadura de la cabeza y del cuello, de tercer grado;F
T204;Corrosión de la cabeza y del cuello, grado no especificado;F
T205;Corrosión de la cabeza y del cuello, de primer grado;F
T206;Corrosión de la cabeza y del cuello, de segundo grado;F
T207;Corrosión de la cabeza y del cuello, de tercer grado;F
T210;Quemadura del tronco, grado no especificado;F
T211;Quemadura del tronco, de primer grado;F
T212;Quemadura del tronco, de segundo grado;F
T213;Quemadura del tronco, de tercer grado;F
T214;Corrosión del tronco, grado no especificado;F
T215;Corrosión del tronco, de primer grado;F
T216;Corrosión del tronco, de segundo grado;F
T217;Corrosión del tronco, de tercer grado;F
T220;Quemadura del hombro y miembro superior, grado no especificado, excepto de la muñeca y de la mano;F
T221;Quemadura del hombro y miembro superior, de primer grado, excepto de la muñeca y de la mano;F
T222;Quemadura del hombro y miembro superior, de segundo grado, excepto de la muñeca y de la mano;F
T223;Quemadura del hombro y miembro superior, de tercer grado, excepto de la muñeca y de la mano;F
T224;Corrosión del hombro y miembro superior, grado no especificado, excepto de la muñeca y de la mano;F
T225;Corrosión del hombro y miembro superior, de primer grado, excepto de la muñeca y de la mano;F
T226;Corrosión del hombro y miembro superior, de segundo grado, excepto de la muñeca y de la mano;F
T227;Corrosión del hombro y miembro superior, de tercer grado, excepto de la muñeca y de la mano;F
T230;Quemadura de la muñeca y de la mano, grado no especificado;F
T231;Quemadura de la muñeca y de la mano, de primer grado;F
T232;Quemadura de la muñeca y de la mano, de segundo grado;F
T233;Quemadura de la muñeca y de la mano, de tercer grado;F
T234;Corrosión de la muñeca y de la mano, grado no especificado;F
T235;Corrosión de la muñeca y de la mano, de primer grado;F
T236;Corrosión de la muñeca y de la mano, de segundo grado;F
T237;Corrosión de la muñeca y de la mano, de tercer grado;F
T240;Quemadura de la cadera y miembro inferior, grado no especificado, excepto tobillo y pie;F
T241;Quemadura de la cadera y miembro inferior, de primer grado, excepto tobillo y pie;F
T242;Quemadura de la cadera y miembro inferior, de segundo grado , excepto tobillo y pie;F
T243;Quemadura de la cadera y miembro inferior, de tercer grado, excepto tobillo y pie;F
T244;Corrosión de la cadera y miembro inferior, grado no especificado, excepto tobillo y pie;F
T245;Corrosión de la cadera y miembro inferior, de primer grado, excepto tobillo y pie;F
T246;Corrosión de la cadera y miembro inferior, de segundo grado, excepto tobillo y pie;F
T247;Corrosión de la cadera y miembro inferior, de tercer grado, excepto tobillo y pie;F
T250;Quemadura del tobillo y del pie, grado no especificado;F
T251;Quemadura del tobillo y del pie, de primer grado;F
T252;Quemadura del tobillo y del pie, de segundo grado;F
T253;Quemadura del tobillo y del pie, de tercer grado;F
T254;Corrosión del tobillo y del pie, grado no especificado;F
T255;Corrosión del tobillo y del pie, de primer grado;F
T256;Corrosión del tobillo y del pie, de segundo grado;F
T257;Corrosión del tobillo y del pie, de tercer grado;F
T260;Quemadura del párpado y área periocular;F
T261;Quemadura de la córnea y saco conjuntival;F
T262;Quemadura con ruptura y destrucción resultantes del globo ocular;F
T263;Quemadura de otras partes del ojo y sus anexos;F
T264;Quemadura del ojo y anexos, parte no especificada;F
T265;Corrosión del párpado y área periocular;F
T266;Corrosión de la córnea y saco conjuntival;F
T267;Corrosión con ruptura y destrucción resultantes del globo ocular;F
T268;Corrosión de otras partes del ojo y sus anexos;F
T269;Corrosión del ojo y sus anexos, parte no especificada;F
T270;Quemadura de la laringe y de la tráquea;F
T271;Quemadura que afecta la laringe y la tráquea con el pulmón;F
T272;Quemadura de otras partes de las vías respiratorias;F
T273;Quemadura de las vías respiratorias, parte no especificada;F
T274;Corrosión de la laringe y de la tráquea;F
T275;Corrosión que afecta la laringe y la tráquea con el pulmón;F
T276;Corrosión de otras partes de las vías respiratorias;F
T277;Corrosión de las vías respiratorias, parte no especificada;F
T280;Quemadura de la boca y de la faringe;F
T281;Quemadura del esófago;F
T282;Quemadura de otras partes del tubo digestivo;F
T283;Quemadura de órganos genitourinarios internos;F
T284;Quemadura de otros órganos internos y de los no especificados;F
T285;Corrosión de la boca y de la faringe;F
T286;Corrosión del esófago;F
T287;Corrosión de otras partes del tubo digestivo;F
T288;Corrosión de órganos genitourinarios internos;F
